{
  "demo": "ls_nash_route_stability",
  "metric_version": "nash_route_stability.v0.1",
  "trail_metric_version": "trail_mcp_metrics.v0.2",
  "interpretation_boundary": "Nash-style route stability proxy, not a formal proof of Nash equilibrium.",
  "thresholds": {
    "min_coalition_gain": 0.1,
    "min_stability_margin": 0.05,
    "min_marginal_contribution": 0.05
  },
  "full_route": {
    "label": "full_cooperative_route",
    "route_key": "customer_i>customer_a>customer_e>planner>executor>consumer_i>consumer_a>consumer_e>verifier>approver",
    "kind": "full",
    "removed_participant": null,
    "reward": 0.8119,
    "outcome_success": true,
    "decision": "success",
    "repeatability_score": 0.9403,
    "success_rate": 1.0,
    "route_health": "promising"
  },
  "baseline_route": {
    "label": "single_route",
    "route_key": "pr_review>local",
    "kind": "baseline",
    "removed_participant": null,
    "reward": 0.1207,
    "outcome_success": false,
    "decision": "weak_signal",
    "repeatability_score": 0.3217,
    "success_rate": 0.0,
    "route_health": "weak"
  },
  "counterfactuals": [
    {
      "label": "single_route",
      "route_key": "pr_review>local",
      "kind": "baseline",
      "removed_participant": null,
      "reward": 0.1207,
      "outcome_success": false,
      "decision": "weak_signal",
      "repeatability_score": 0.3217,
      "success_rate": 0.0,
      "route_health": "weak"
    },
    {
      "label": "without_customer_environment",
      "route_key": "customer_i>customer_a>planner>executor>consumer_i>consumer_a>consumer_e>verifier>approver",
      "kind": "ablation",
      "removed_participant": "customer_environment",
      "reward": 0.7411,
      "outcome_success": true,
      "decision": "success",
      "repeatability_score": 0.9097,
      "success_rate": 1.0,
      "route_health": "promising"
    },
    {
      "label": "without_customer_aquarium",
      "route_key": "customer_i>customer_e>planner>executor>consumer_i>consumer_a>consumer_e>verifier>approver",
      "kind": "ablation",
      "removed_participant": "customer_aquarium",
      "reward": 0.7157,
      "outcome_success": true,
      "decision": "success",
      "repeatability_score": 0.8997,
      "success_rate": 1.0,
      "route_health": "promising"
    },
    {
      "label": "without_customer_individual",
      "route_key": "customer_a>customer_e>planner>executor>consumer_i>consumer_a>consumer_e>verifier>approver",
      "kind": "ablation",
      "removed_participant": "customer_individual",
      "reward": 0.627,
      "outcome_success": true,
      "decision": "success",
      "repeatability_score": 0.866,
      "success_rate": 1.0,
      "route_health": "promising"
    },
    {
      "label": "without_consumer_environment",
      "route_key": "customer_i>customer_a>customer_e>planner>executor>consumer_i>consumer_a>verifier>approver",
      "kind": "ablation",
      "removed_participant": "consumer_environment",
      "reward": 0.7526,
      "outcome_success": true,
      "decision": "success",
      "repeatability_score": 0.913,
      "success_rate": 1.0,
      "route_health": "promising"
    },
    {
      "label": "without_consumer_aquarium",
      "route_key": "customer_i>customer_a>customer_e>planner>executor>consumer_i>consumer_e>verifier>approver",
      "kind": "ablation",
      "removed_participant": "consumer_aquarium",
      "reward": 0.7272,
      "outcome_success": true,
      "decision": "success",
      "repeatability_score": 0.903,
      "success_rate": 1.0,
      "route_health": "promising"
    },
    {
      "label": "without_consumer_individual",
      "route_key": "customer_i>customer_a>customer_e>planner>executor>consumer_a>consumer_e>verifier>approver",
      "kind": "ablation",
      "removed_participant": "consumer_individual",
      "reward": 0.6284,
      "outcome_success": true,
      "decision": "success",
      "repeatability_score": 0.858,
      "success_rate": 1.0,
      "route_health": "promising"
    },
    {
      "label": "reordered_levels",
      "route_key": "customer_a>customer_i>customer_e>planner>executor>consumer_a>consumer_i>consumer_e>verifier>approver",
      "kind": "deviation",
      "removed_participant": null,
      "reward": 0.6296,
      "outcome_success": true,
      "decision": "success",
      "repeatability_score": 0.865,
      "success_rate": 1.0,
      "route_health": "promising"
    },
    {
      "label": "no_levels_flat",
      "route_key": "customer_i>planner>executor>consumer_i>verifier>approver",
      "kind": "deviation",
      "removed_participant": null,
      "reward": 0.591,
      "outcome_success": true,
      "decision": "success",
      "repeatability_score": 0.8511,
      "success_rate": 1.0,
      "route_health": "promising"
    }
  ],
  "participant_marginal_contributions": [
    {
      "participant": "customer_environment",
      "without_route": "customer_i>customer_a>planner>executor>consumer_i>consumer_a>consumer_e>verifier>approver",
      "without_reward": 0.7411,
      "marginal_contribution": 0.0708
    },
    {
      "participant": "customer_aquarium",
      "without_route": "customer_i>customer_e>planner>executor>consumer_i>consumer_a>consumer_e>verifier>approver",
      "without_reward": 0.7157,
      "marginal_contribution": 0.0962
    },
    {
      "participant": "customer_individual",
      "without_route": "customer_a>customer_e>planner>executor>consumer_i>consumer_a>consumer_e>verifier>approver",
      "without_reward": 0.627,
      "marginal_contribution": 0.1849
    },
    {
      "participant": "consumer_environment",
      "without_route": "customer_i>customer_a>customer_e>planner>executor>consumer_i>consumer_a>verifier>approver",
      "without_reward": 0.7526,
      "marginal_contribution": 0.0593
    },
    {
      "participant": "consumer_aquarium",
      "without_route": "customer_i>customer_a>customer_e>planner>executor>consumer_i>consumer_e>verifier>approver",
      "without_reward": 0.7272,
      "marginal_contribution": 0.0847
    },
    {
      "participant": "consumer_individual",
      "without_route": "customer_i>customer_a>customer_e>planner>executor>consumer_a>consumer_e>verifier>approver",
      "without_reward": 0.6284,
      "marginal_contribution": 0.1835
    }
  ],
  "stability": {
    "nash_style_stable": true,
    "decision": "stable_candidate",
    "coalition_gain": 0.6912,
    "best_counterfactual_route": "customer_i>customer_a>customer_e>planner>executor>consumer_i>consumer_a>verifier>approver",
    "best_counterfactual_reward": 0.7526,
    "stability_margin": 0.0593,
    "minimum_marginal_contribution": 0.0593,
    "needs_more_runs": true
  },
  "ranking": [
    {
      "route_key": "customer_i>customer_a>customer_e>planner>executor>consumer_i>consumer_a>consumer_e>verifier>approver",
      "pheromone_weight": 0.8119,
      "runs": 1,
      "successes": 1,
      "avg_quality": 0.9283,
      "avg_goal_alignment": 0.9,
      "avg_latency_ms": 1800.0,
      "last_used_at": "2026-05-24T20:39:45.898266+00:00",
      "success_rate": 1.0,
      "repeatability_score": 0.9403,
      "metric_version": "trail_mcp_metrics.v0.2",
      "needs_more_runs": true,
      "route_health": "promising"
    },
    {
      "route_key": "customer_i>customer_a>customer_e>planner>executor>consumer_i>consumer_a>verifier>approver",
      "pheromone_weight": 0.7526,
      "runs": 1,
      "successes": 1,
      "avg_quality": 0.8583,
      "avg_goal_alignment": 0.9,
      "avg_latency_ms": 1600.0,
      "last_used_at": "2026-05-24T20:39:46.211488+00:00",
      "success_rate": 1.0,
      "repeatability_score": 0.913,
      "metric_version": "trail_mcp_metrics.v0.2",
      "needs_more_runs": true,
      "route_health": "promising"
    },
    {
      "route_key": "customer_i>customer_a>planner>executor>consumer_i>consumer_a>consumer_e>verifier>approver",
      "pheromone_weight": 0.7411,
      "runs": 1,
      "successes": 1,
      "avg_quality": 0.85,
      "avg_goal_alignment": 0.9,
      "avg_latency_ms": 1600.0,
      "last_used_at": "2026-05-24T20:39:46.036669+00:00",
      "success_rate": 1.0,
      "repeatability_score": 0.9097,
      "metric_version": "trail_mcp_metrics.v0.2",
      "needs_more_runs": true,
      "route_health": "promising"
    },
    {
      "route_key": "customer_i>customer_a>customer_e>planner>executor>consumer_i>consumer_e>verifier>approver",
      "pheromone_weight": 0.7272,
      "runs": 1,
      "successes": 1,
      "avg_quality": 0.8333,
      "avg_goal_alignment": 0.9,
      "avg_latency_ms": 1600.0,
      "last_used_at": "2026-05-24T20:39:46.271556+00:00",
      "success_rate": 1.0,
      "repeatability_score": 0.903,
      "metric_version": "trail_mcp_metrics.v0.2",
      "needs_more_runs": true,
      "route_health": "promising"
    },
    {
      "route_key": "customer_i>customer_e>planner>executor>consumer_i>consumer_a>consumer_e>verifier>approver",
      "pheromone_weight": 0.7157,
      "runs": 1,
      "successes": 1,
      "avg_quality": 0.825,
      "avg_goal_alignment": 0.9,
      "avg_latency_ms": 1600.0,
      "last_used_at": "2026-05-24T20:39:46.091816+00:00",
      "success_rate": 1.0,
      "repeatability_score": 0.8997,
      "metric_version": "trail_mcp_metrics.v0.2",
      "needs_more_runs": true,
      "route_health": "promising"
    },
    {
      "route_key": "customer_i>customer_a>customer_e>planner>executor>consumer_a>consumer_e>verifier>approver",
      "pheromone_weight": 0.6284,
      "runs": 1,
      "successes": 1,
      "avg_quality": 0.7217,
      "avg_goal_alignment": 0.9,
      "avg_latency_ms": 1700.0,
      "last_used_at": "2026-05-24T20:39:46.322233+00:00",
      "success_rate": 1.0,
      "repeatability_score": 0.858,
      "metric_version": "trail_mcp_metrics.v0.2",
      "needs_more_runs": true,
      "route_health": "promising"
    },
    {
      "route_key": "customer_i>planner>executor>consumer_i>verifier>approver",